{
  "$schema": "https://the-aico.com/schema/employee.json",
  "name": "backend",
  "role": "Backend Engineer",
  "description": "Full-stack backend development: API design, database, business logic, TDD, and system architecture",
  "skills": [
    {
      "name": "init",
      "files": [
        {
          "path": "skills/init/SKILL.md",
          "type": "skill"
        },
        {
          "path": "skills/init/references/constraints.template.md",
          "type": "reference"
        }
      ]
    },
    {
      "name": "task-breakdown",
      "files": [
        {
          "path": "skills/task-breakdown/SKILL.md",
          "type": "skill"
        },
        {
          "path": "skills/task-breakdown/references/task-file-template.md",
          "type": "reference"
        }
      ]
    },
    {
      "name": "plan",
      "files": [
        {
          "path": "skills/plan/SKILL.md",
          "type": "skill"
        }
      ]
    },
    {
      "name": "implement",
      "files": [
        {
          "path": "skills/implement/SKILL.md",
          "type": "skill"
        }
      ]
    }
  ],
  "commands": [
    {
      "name": "init",
      "files": [
        {
          "path": "commands/init.md",
          "type": "command"
        }
      ]
    },
    {
      "name": "tasks",
      "files": [
        {
          "path": "commands/tasks.md",
          "type": "command"
        }
      ]
    },
    {
      "name": "plan",
      "files": [
        {
          "path": "commands/plan.md",
          "type": "command"
        }
      ]
    }
  ],
  "docs": [],
  "dependencies": [
    "@the-aico/_shared/code-review",
    "@the-aico/_shared/subagent-driven",
    "@the-aico/_shared/worktree"
  ]
}
